complaint,category
Why food quality even in Rajdhani deteriorating. PNR: 2741306144 Dibrugarh Rajdhani-such a drastic change. No sweet ,food
its mess with unreserved passengers in gowthami super fast express. Lingampally to kakinada port...      Missing from 7.13 am Borivali-Churchgate Train.  Des      Missing from 7.13 am Borivali-Churchgate Trai ,journey
"is The most pathetic site. Everything is so confusing & their helpline is more confusing than that, trying t ",security
train no. 12529 on 9-4-2019 delayed deliberately by the railway for more than ,journey
"Hi Team, PNR NO: 2739409261 I lost my wallet with my railway ticket in it. I have taken this ticket from Mulund s ",journey
Financial Express: Don\xe2\x80\x99t worry about summer heat on  platforms! This new mist cooling system is uber ,others
In india the time of all the  are important n those who make them  are useless now  ,others
Indian Railways make a smashing hit in Make in India initiative Read here in details  ,others
Hello I boarded Shatabadi (Train no. 12006) today at 6:53 AM. Forget a book (novel) while de-boarding. My seat numb ,others
Trains between Satna(sta) And Ahmedabad(adi) stations  ,journey
Early morning breakfast was bread and omlet with a layer of fungus on it. While after dinner we had blanket with a ,food
A new  for ! Free  at 500 stations in just 7 days. Check details | Business News  ,others
express catches fire during maintenance work at Indore | Download the ET App:  . ,digital
"If u want to learn the art to delay no one other  can teach u better,delay of 19 mins turned into 41 ",journey
Lovely food great service 1Ac MumbaiDelhi Rajdhani 12951 first timeexperience.  cant manager AkshayS ,food
"celebrate Golden Jubilee of the first , from Howrah-New Delhi, its first .",others
thank you sir  \xf0\x9f\x8c\x9e \xf0\x9f\x8c\x9e ,others
"Sahibabad railway station of NR (Northern Railway) becomes the 1,500th station to be live with RailWire Wi-Fi.  to see positive transformation in Indian Railways, free WiFi, train running right on time, cleaning is s ",clean
bAt Sambalpur City station. Its as clean as possible. Thank you  ,clean
\xe2\x80\x99 first cyber crime cell to start in  | Pune News - Times of India ,others
trains in India never run on time ,others
"well... for the past 5 years, i am literally fed up of picking up my relatives at odd times like  3am, 4 am, courte ",others
Safest year! This new record by Indian Railways in FY19 will cheer every passenger   ,health
GHY-Okha Express decorated with voters awareness materials urging people to participate in the ensuing Lok Sabha Election wa,others
Missed Train? Don\xe2\x80\x99t Worry! \xe2\x80\x99 Big Relief for Passengers.\\\\,others
Pathatic service. Train 01666 is late more than 8 hours. I traveled from Naughachiya t ,journey
Pnr number: 2455222647 Please request railway minister to atleast provide water..because there is no pantry in this ,journey
SCAM   Selling local water  rate of 20rs no rail neer in jaipur stn to bdts. Local water sealed open who ,journey
Adding extra engines to add extra power to push the train up the ghat   ,others
GHY-Okha Express decorated with voters awareness materials urging people to participate in the ensuing Lok Sabha Election wa,others
Missed Train? Don\xe2\x80\x99t Worry! \xe2\x80\x99 Big Relief for Passengers.\\\\,others
No more inconvenience while booking tickets for your travel. Pay through  e-wallet and  within minutes,journey
I hail from Hyderabad. Salan and Raita are my best friends. People of all ages enjoy devouring a hot plate.   ,journey
Urgently needed doctor a child has sallowen a coin indore rajendranagar express coach no. S 10  ,others
"to have high-speed trains, better stations, passenger amenities: Top pr ",others
"In hot summer, Anand railway stations water point is closed with a board main ",journey
"Sahibabad railway station of NR (Northern Railway) becomes the 1,500th station to be live with RailWire Wi-Fi.  station of NR (Northern Railway) becomes the 1,500th station to be live with RailWire Wi-Fi. ",others
Missed Train? Don\xe2\x80\x99t Worry! \xe2\x80\x99 Big Relief for Passengers.\\\ ,others
Speedy Queen Of SER 12859 GITANJALI Express Linked ET P4 : Indian Railways  via ,others
Speedy Queen Of SER 12859 GITANJALI Express Linked ET P4 : Indian Railways  via ,others
"to have high-speed trains, better stations, passenger amenities: Top promises in  ",others
Watch the Video on Faster Calculation Tricks to Solve Number System for  JE Preparation and Increase your chanc ,others
"I m very emotional today. A delicious lunch you have served. Thank you  ji,  ",food
"No cleaning,and no water in GariRath 12203,toilet are very dirty Why we will pay....\ ",journey
Trains between Itarsi(et) And Kanpur(cnb) stations  ,journey
 SCR set deadline to achieve 100% electrification by 2021-22    ,others
Sahibabad station over Northern Railway has become the  station in the country to get free  facility pr ,others
"I am traveling via Humsafar express train no.(22354), and I heard these trains are the best, but they are not facil ",others
still i didnt received my balance pnr no. 6127262036 ????,health
presents Mata Vaishnodevi with Amritsar 3AC Charter Coach Ex Ahmedabad. Places covered will be Mata Vaishnod ,health
"IR achieves new heights with the Make In India Record: Over 6,000 Coaches Manufactured Indigenously In FY19 ",others
was saying few minutes back : 1.25 crore families had left Gas subsidy (after he asked ,others
Central Railway empowers RPF personnel with electric Segway scooters  |  ,others
Why  has installed cameras on the exterior of   ,security
Why  has installed cameras on the exterior of   ,security
Central Railway empowers RPF personnel with electric Segway scooters  |  ,others
Atleast railway should consider seat preference for senior citizens and mothers with infants while online ticket bo ,journey
bWhats the point in asking for seat  preference while booking tickets when we dont get the preferred one. ,journey
"As a trusted partner of the Indian Railways, Jindal Stainless reaffirmed its association with the national transpor ",others
11:45 thane local leaving at 12:03 am but we are happy with the fact that every 4 5 mins there is a train.  Things ,digital
"writes off residential arrear dues of 72 months, approves 10% yearly hike in maintenance fee ",digital
"Indian Railway jobs 2019: Apply for RRC Group D 103769 Level 1 posts, Check important dates, Railway exam fees and ",digital
"Make In India Boost.....  Indian Railways sets new Make in India record! Over 6,000 Coaches manufactured in FY:18-1 ",others
"Railway Employees Caught Consuming Alcohol in Mumbai-Delhi Rajdhani Express, Case Registered  ",security
"Train no 12266..coach H 1-C...Disappointed to see that in Fitst AC coach,even water bottles not served to sad experience traveling by 1st AC 12551. Delayed by 5 hrs, garbage all over, rats roaming around, no ",journey
Trains between Bina(bina) And Tirupati(tpty) stations  ,journey
Do we need to pay for urine in railway?    ,others
I had book ticket with PNR number : 4456397397. As the train was delayed to depart by ,journey
"I was stuck in traffic, was getting late and have to reach station to see off my wife. I had to a buy a platform ti ",journey
water is not available in S3 coach in  12295 Sanghamitra express train is arrive at Nagpur junction,journey
water is not available in any coach in train no. 12295 Sanghamitra express,journey
New Delhi-Bhubaneswar Rajdhani Express Passengers Fall Ill After Consuming Dinner Served by IRCTC On Board Train  ,food
time to make the food at shatabdi and Rajdhani as optional. We dont want to eat junk and pay for i ,food
Trains between Chandrapur(bpq) And Bilaspur(bsp) stations  ,journey
Inconvenience is regretted has lost it\s meaning when it comes to Indian Railways.  When my train i ,others
Its very unfortunate that our government working for bullet train but Indian railways not taking ,others
"In 12343 darjeeling mail 2nd class coach one ladies is in dengar, please help , RPF helpline no are not working, ne ",security
allows the user to book tickets to his favorite  destination within minutes and offer the user to pay for,journey
Trains between Ludhiana(ldh) And Chandrapur(bpq) stations       The drum sitters have gone one s ,journey
I have discovered the worlds worst coffee. Its at  Even worse than  coffee. That is a fine achie,others
RAC waiting ticket confirm hona ek IPL match jeetne k Barabar hai. ,journey
bWhy your system is careless about passenger service. day by day in 12343 Darjeeling mail huge peoples are travelin ,others
Indian railways electric locomotive class WAP4      ,others
great job! Train stopped immediately after started from halt to pick up old ladies. I feel like local bus.. cool motor man!,journey
travelling in Malwa xpress..pathetic service .. dirty bed sheet .. no blanket no towe ,clean
Thanks to our honourable prime minister  and  to start bande Bharat train from varansi ,journey
Nimbu pani has been banned at due to unavailability of  quality checks mechanism  xe2\x80\xa6,others
I want to carry about 150kg books from Kota Junction(KOTA) to Akbarpur(ABP) on 31May on 13238 What to do for that? ,journey
Can you share the progress of the work regarding the length,others
This is unbelievable! Indian railways earned 20cr ($3m) from private caparking charges in the last FY. ,others
Prompt action by taxi driver saved a life of a passenger from coming under the wheels of an express train at Agra C ,others
Travelling Lucknow Mail vide PNR No 226-015-1199 1Ac Cabin F Upper Birth. Pathetic condition of toilet stinking. ,others
Kamakhya-Gandhidham Express train decorated with the message from ECI urging people to participate in the upcoming ,journey
Dear  Must appreciate your punctuality the train which was suppose to be a departure at 5AM reach ,digital
Around 20 passengers on board of Delhi-Bhubaneswar  were today reportedly ill after eating meals served by ,health
13151 - started on 6th from KOAA has barely moved after leaving Lucknow around 2pm. Whats going on? ,others
why Mahananda(15483) has been canceled on 04/04/19???? Still i did no ,health
"Visit the state of the art tourist attraction, Sydney Opera House with all-inclusive  tour packages offer ",others
Awsme cleaning wrk and grt stff Proud of u INDIAN RAILWAY ... ,clean
New post on the blog: Photo essay: Nilgiri mountain railway: toy train from Coonor to Ooty  ,journey
allows the user to book tickets to his favorite  destination within minutes and offer the user to pay ,journey
News is coming from sleeper class as well. Some small children got hurted.    ,health
Train no 13202 has been attacked by stone pelter near Gadarwara Stn. Emergency window of B2 has been shattered. Tra ,others
"Traveling frm bpl to ujjain today, by mistake bookd tickt fr 7.5.19. rqsted TT to tell any alternative as i was wit ",others
"constantly reminding us what IST stands for. A superfast train is also made to stop at stations and  This is a special vending machine for purified water, a dire necessity for that passengers. Good... ",journey
20 passengers taken ill after eating rail food   ,food
"Excellent passengers\xe2\x80\x99 executive lounge at  railway station, the lounge has a good waiting hall, wash rooms for a showe dear rail india... We dont need bullet trains now.. please improve old indian railway sy ",others
Awsme cleaning wrk and grt stff Proud of u INDIAN RAILWAY ... ,clean
Indian Railways records the best safety figures with record low accidents   ,others
"Excellent passengers\xe2\x80\x99 executive lounge at  railway station, the lounge has a good waiting hall, wash rooms for a showe  of n: Railways (Long route) :  and grievance redressal through Twitter BIG T ",others
bSunday Joy Ride: Explore Mumbais Harbour Line:   ,others
Big Thanks!! for improving servies and infrastructure of Railways. doing gud Jo,others
Gentle giant !! Mesmerising magical  sounds of engine!! Always fascinating!!  pride of India !! ,others
20506 Dibrugarh Rajdhani standing at platform no-16 Ndls for last 50 mins. Nobody is r ,others
Train number 12781 S3 coach No water in train ... Pls do something... We have been facing water problem Train number 12781 S3 coach No water in train ... Pls do something... We have been facing wat ,journey
The  government has renamed the iconic  Railway Station as Puratchi Thalaivar Dr ,others
SCR set deadline to achieve 100% electrification by 2021-22    ,others
is the second largest rail network in the world.  Millions of women travel across the country by tr ,health
Corruption in  is on Heights.  collects money in lieu of tickets very often. Govt officials please look into this ,journey
"Indian Railways merges TC, CC and ECRC posts, to conduct only one exam    ",others
"New Line, Doubling, Tripling and Gauge Conversion: Targets for FY 2019-20   ",others
"CR: Several Doubling, Tripling Works to be Partly Commissioned in April, May, June  ",others
my sister and her 2 childrens are in train 17307 TT tok general ticket and  money from them for reserve  Ticket in,journey
"CR: Several Doubling, Tripling Works to be Partly Commissioned in April, May, June  ",others
"New Line, Doubling, Tripling and Gauge Conversion: Targets for FY 2019-20   ",others
You know you are getting old when the  Indian loo becomes an acrobatic act worthy of an Olympic gold. \xf0\x9f\x98\x82,others
Woman develops labour pain in local train; delivers baby at one-rupee clinic at  Railway Station   Out of curiosity do have the same agenda for as  una     Can you share the progress of the work regarding th ,others
The  government has renamed the iconic  Railway Station as Puratchi Thalaivar ,others
"Major scam in   ticketing, customers had to buy  from private operators site at higher price. Ticket for IA, t Hi Sir,  We have seen lot of developments in last 5 years especially in   we will s ",journey
"2/2. Complaint portal of   fundamentally defective. For complaints of ticketing site, station and pl ",journey
"Major scam in   ticketing, customers had to buy  from private operators site at higher price. Ticket for IA, t",journey
"Major scam in   ticketing, customers had to buy  from private operators site at higher price. Ticket ",journey
Now spending the night with some wonderful bugs in Nilagiri Express -12672\xc2\xa0- A2  and good for health. ,health
Sir I have booked my bike through railway on 3rd of April And now in the destination ,others
Wud suggest not to sell anything without visible rate list in trains. Got duped in Kerala Exp yesterday. PNR 262119 ,others
sucks   only 3hrs late train no.12409 who is responsible for the lose,journey
urgent  required palitana- bandra express . Coach s2 seat number 75,others
Plz clean toilets at my coach. Pathetic smell. Rude answers given by tc & house keeping. They say ,clean
"Excellent passengers\xe2\x80\x99 executive lounge at  railway station, the lounge has a good waiting hall, wash rooms ",others
No more inconvenience while booking tickets for your travel. Pay through  e-wallet and  within minutes,journey
"UPDATED. More trains from added to list. Summer Specials: Over 200 New Services in April, May and June from CR",journey
SCR set deadline to achieve 100% electrification by 2021-22    ,others
Sir   Goa express 12779 is stands near  since last 4 hours. Please do needful  ,journey
under the visionary and dynamic leader is creating wonders on daily basis.  Thankyou s ,others
This is what last mile delivery in  truly looks like!  \xf0\x9f\x98\x81   ,others
Time when i clicked this pic &gt;&gt; 08:00 pm ... This is the condition of  .. They shut the ,others
& We are at gauribidanur railway station for 11302 udyan exp but without any crossin ,others
The IRCTC offers the facility of booking   on concessional fares for disabled persons. How to book co ,others
Trains between Bhopal(bpl) And Delhi(ndls) stations  ,journey
Celebrating 3rd Anniversary of Indias fastest train ( Gatiman Express ) This is the only video which I captured of th,others
Whats the last time you had that rush of a feeling?       ,others
Generator Van of GariRath is apparently making the environment GARI very badly!   ,digital
Two sides of a moment....        ,others
bWhats the last time you had that rush of a feeling?       ,others
This is what last mile delivery in  truly looks like!  \xf0\x9f\x98\x81   ,others
That why people doesn\xe2\x80\x99t want to travel with indian railways ... no point to pay so high price for First AC where ,others
"UPDATED. More trains from added to list. Summer Specials: Over 200 New Services in April, May and June from CR Train no 12266..coach H 1-C...Disappointed to see that in Fitst AC coach,even water bottles not serv ",journey
bwhat is wrong with this train any idea ?      its waiting time. \xf0\x9f\x92\xa5\xf0\x9f\x94\xa5\xf0\x9f\x91\xb9\xf0\x9f\x91\xbf\xf0\x9f\x98\x88 ,others
Ample of patients commute from K.R.Puram Bangalore in 12864 but everyday coach positions are changed and stoppage t ,journey
am traveling on pragati express from Mumbai to Pune in C1. The aircon was lowered 30kms before reac ,journey
"Hello NR management, As a responsible citizen of India, just want to let you know that still after paying such a hi ",health
RRBResult is out after manipulation of several times leads selection to rejection.. Is it not a corru    Dirty and stinking toilets in train no 16335 coach B2 PNR no- 831707 ,clean
Allahabad: Vande Bharat Express to install additional CCTVs    ,others
"UPDATED. More trains from added to list. Summer Specials: Over 200 New Services in April, May and June ",journey
Shouldnt Bhutans constitution to keep tourist attractions and environment clean be a part of every countrys constitut,clean
Where the hell is the light and fan ? Burning our bodies in hell time of the summer   ,others
"The Indian Railways has registered its best safety figures in almost four decades in 2018-2019 till March, data has ",health
so much dust on upper berths of Indore to khajuraho rail no. 19663. Dirty toilets as well. Cleanliness must,clean
train 04404 its not like a AC special Train. 4 hr delay and all Train passes but this ,journey
Trains between Raipur(r) And Satna(sta) stations  ,journey
Western Railway ensures Highest Infrastructure Works of 240 Kms During 2018-19  ,others
Article published in Deccan Herald lies about Indian Railways performance   ,others
so much dust on upper berths of Indore to khajuraho rail no. 19663. Dirty toilets as well. Cleanli ,clean
Sets Goal Of Capturing 50 Per Cent Of Freight Traffic By 2030  via,others
"traveling in train no 19663 indore to khajuraho.... Coach no S1... seats are very dirty, toilet sme ",clean
"Train no 12561,always runs late. Till date no action has been taken by  .It is rediculous and shamef ",journey
Been travelling in trains from last 20 y,others
"Daily Update on Rail & Metro Progress - Apr 06, 2019 | By Rail Analysis India   ",others
Western Railway ensures Highest Infrastructure Works of 240 Kms During 2018-19  ,others
SCR set deadline to achieve 100% electrification by 2021-22    ,others
Chennai Central is now MGR Central       ,others
"Exclusive Insight : The Impact of MCF, Raebareli on the City Read Here...   xe2\x80\xa6",others
Why can\xe2\x80\x99t we pay for platform ticket with parking? It will save so much of time and increase revenue for ,journey
Been travelling in trains from last 20 y,others
Impressive!  adds 500 more stations to free WiFi list in just 7 days |   ,digital
achieving new milestones in the last five years under Modi Govt ,others
Number of railways mishappenings reduced by 94.8% since FY 18-19: Report...    ,digital
"Exclusive Insight : The Impact of MCF, Raebareli on the City Read Here...   xe2\x80\xa6",others
"Exclusive Insight : The Impact of MCF, Raebareli on the City Read Here...  ",others
Dankuni unit of CLW produced 50 locomotives in 2018-19     ,others
SCR set deadline to achieve 100% electrification by 2021-22    ,others
"New India: [Train:12505] - 6:25 total travelling time and 5 hours train late, what a service.   ",journey
Western Railway ensures Highest Infrastructure Works of 240 Kms During 2018-19  ,others
"RRALP, Technician CBT II Exam Result Declared! Check Important Instructions for Next Stage Group C Aptitude Test  ",others
"RRALP, Technician CBT II Exam Result Declared! Check Important Instructions for Next Stage Group C Aptitude Test ",others
"In 2019, after implementation of 6th CPC, most of central govt employees in GP 4200 and above were given  Gazatted Please look into the picture      ",others
likely to release hall tickets at least 10 days before CBT 1; click to read de ,journey
"If you prefer healthy meals and want to enjoy it onboard, then you can easily do so by ordering Classic Caesar Sala ",health
"Record setting , be it manufacturing coaches, export, electrification, modernisation, safety, the ef ",others
Trains between Chennai(mas) And Jhansi(jhs) stations  ,journey
or Utkrisht Double Decker Air Conditioned Yatri Express are completely Double-Decker AC chair car trains d,others
bCelebrating 3rd Anniversary of Indias fastest train ( Gatiman Express ) This is the only video which I captured of ,others
I am traveeling on train no.  16351 nagercoil express...  A person has littered and soiled my seat with his shoes.. ,others
achieves 5 remarkable firsts in FY19! World-class trains and stations to high-powered locos.@ You have a pathetic wesite. My registration is stuck because you are not sending the mobile OTP ev ,others
Wastage of water \xf0\x9f\x98\x91     ,journey
Impressive!  adds 500 more stations to free  list in just 7 days  \ ,others
Cameras installed on  to identify people pelting stones   ,security
Boost for regional transport! Check out these upcoming rapid rail projects  \ ,others
Chennai Central is now MGR Central       ,others
"CR: Several Doubling, Tripling Works to be Partly Commissioned in April, May, June  ",others
No more inconvenience while booking tickets for your travel. Pay through  e-wallet and  within mi ,journey
registers its best safety figures in almost four decades   ,others
Pathetic coach and washroom condition in  - 12978. No water in washrooms since last night. Train r ,journey
Free  at 500 rail stations in 7 days!  creates record; now 1500 stations have internet ,digital
"RRALP,  CBT Results declared, whats next?        ",others
register its best safety figures in almost four decades . ,others
Some beautiful pictures can\t be discovered without getting lost ! \\\\,others
Some beautiful pictures can\t be discovered without getting lost ! \\\ ,others
"RRALP CBT 2 Result 2019 announced, check your roll number here     ",others
Trains between Raipur(r) And Rajkot(rjt) stations  ,journey
What if you lost your train journey ticket? Here are the things you should do if such incident happened. Click here ,journey
officer please support. Why 12561 train is late. Please look into it. Advise the concerned official ,journey
Fantastic! The Indian Railways just recorded its safest year ever!  ,others
register its best safety figures in almost four decades . ,others
There have been a huge discrepancy in recent ALP CBT 2 MARKS i,others
For the love of  ,others
"The  has registered its best safety figures in almost four decades in 2018-2019 till March, data has show     Been travelling in trains from la ",health
The toilets are really unclean in  ALD DURANTO EXP 12293 PNR- 8116589279 (B3). Can someone do anything about this? ,clean
"Booking  ticket at IRCTC? Now, get  up to Rs 10 lakh for just 49 paise ",journey
water shortage in train jpr to indore exp 12974.,journey
"The  has registered its best safety figures in almost four decades in 2018-2019 till March, data has ",health
"Now, enjoy world-class facilities at Indian Railways lounges.   Kudos to Sir & team. ",food
"Bag with gold ornaments and cash has been stolen an hour back today from my friend Arnab, travelling towards Malda ",journey
Ok now m receiving curses from these passengers as i troubled them. Was it necessary for me to reserve a seat and g ,journey
"what a great service provide by Indian railways , there is not water in  B5  ,Konark express , 11019. ",journey
bPeople pay for what they want to have no matter if they cant have it again.   ,others
"The  has registered its best safety figures in almost four decades in 2018-2019 till March, data has sh",health
train stand  even in  for  that didnt  du ,others
"Medu Vada is a fritter in the doughnut shape made from batter of finest quality black gram, fried and served with speci",others
So Chennai Central is now officially  DR MG RAMACHANDRAN CENTRAL  railway station. Another big big station on the ,others
the worst situation of railway continues traian no 15024 yaswantpur -Gorakhpur express boarded yesterday thi,others
\xe2\x80\x99 Surat station to become -class multi-modal transport hub; check 5 facts on the project ,others
\xe2\x80\x99 Surat station to become -class multi-modal transport hub; check 5 facts on the project ,others
Booked a Ticket for 16594 and seat was allotted in coach No SE1 But there is no Identification marks where the extr ,journey
"CR: Several Doubling, Tripling Works to be Partly Commissioned in April, May, June  ",others
From Discover on Google     Keep up the good work ,others
Beautiful Erode WDG 3a merrily chugging through the diesel heaven line towards POY with 22652 PGT-MAS Superfast Pic:Alb    No proper bed roll  provided.  Got a pillow that is ,health
"bIts not ac or sleeper Its genral bogie,(m.p.samparkranti) Thanx  ",others
s role in safety of people is limited to our understanding of our own safety.  You cant expect a ,others
Link in bio.             I suggest CCTV must be available in all waiting hall to protect our luggage ,others
There is no food in train 17311. AC attendant in 2 tier is asking for \xe2\x82\xb9150 per person to get veg thali. It says \xe2\x82\xb950 ,food
