complaint,category
"The  has registered its best safety figures in almost four decades in 2018-2019 till March, data has sh",health
"bPiyushGoyal have you read this? Now,  please dont play with  or call this paper . Nor should yo ",others
"The  has registered its best safety figures in almost four decades in 2018-2019 till March, data has sh",health
"The  has registered its best safety figures in almost four decades in 2018-2019 till March, data has ",health
bJust Used RailWire WiFi Services from Indian Railways at Subzi Mandi Railway Station and i feel its quite amazing ,digital
"CR: Several Doubling, Tripling Works to be Partly Commissioned in April, May, June  ",others
"CR: Several Doubling, Tripling Works to be Partly Commissioned in April, May, June  ",others
Shouldnt Bhutans constitution to keep tourist attractions and environment clean be a part of every countrys constitut,clean
"CR: Several Doubling, Tripling Works to be Partly Commissioned in April, May, June  ",others
delay of ispat express 12871 at bargarh station. Train no. 12871. It has been1/2 an hour gone train halt at bargarh ,journey
report was scrapped as usual.  Issue of promotional avenue for  SSEs,others
Magnificently built and Incredibly cleaned  Railway station.. experience..special thanks to our Hon. ,clean
Trains between Ahmedabad(adi) And Bhopal(bpl) stations  ,journey
"bExperience top international destinations that include Singapore, Phuket, Dubai and more with  Tourisms all- ",others
"A historically significant event, the onset of railway operations in  ushered in a new chapter of progres ",others
Impressive!  adds 500 more stations to free WiFi list in just 7 days |   ,digital
"Choose from multiple payment options like credit/debit cards, net banking, e-wallet, for every ticket booked throug ",journey
Impressive!  adds 500 more stations to free WiFi list in just 7 days |   ,digital
A bunch of  replies show how the  have been run down during the Modi years despite the hype and the hoopla water bottle cost \xe2\x82\xb9 15 is being sold for 20?(GST + 5) for what +5 is being charged by catering servic ,journey
But what about the railways ...? \xe2\x80\x8bThe myth of Britains gifts to India  The paragraph that I,others
Safest year! This new record by  in  will cheer every passenger  via,health
revamped. Kudos  Passenger convenience and amenities are much needed at Railway ,others
"Please ensure proper water for passengers, more than 3 decades this Station and area is negle",journey
A bunch of  replies show how the  have been run down during the Modi years despite the hype and ,others
Chairman Railway Board launches various digital initiatives on Indian Railways  ,digital
"Fantastic news!  Number of consequential accidents, 59 in 2018-19. This exemplies transformative leadershi ",health
Incredible Facts About Indian Railways That You Probably Never Knew    ,others
"Medu Vada is a fritter in the doughnut shape made from batter of finest quality black gram, fried and served with s    is still in British era in India 5.0 : Indi and Beyon ",health
and   teamed up for  services. ,food
"An Exclusive Interview with Mr. Lalit Chandra Trivedi ,General Manager at East Central Railway Subscribe to Our Ma ",others
to deploy  Kaizala to connect its employees with healthcare services  ,health
"Thanks to and sir..for problem that we are facing ,has been resolved \xf0\x9f\x98\x8a\xf0\x9f\x98\x81 within an hour.   report was scrapped as usual.  Issue of promotional avenue for ",others
"Train No. 14681, Coach D2, Littering smell is all over the coach and that too when it starts from NDLS  ",journey
The poor functioning of the  under Modi. ,others
"restricted for security forces\xe2\x80\x99 movement! Check  alternative, imp ",others
"Train No. 14681, Coach D2, Littering smell is all over the coach and that too when it starts from NDLS  ",journey
shows how   performance declined under  !  Never mind...part-time  ,others
"Good news for  employees, pensioners and passengers: New services launched; know how you benefit  news for  employees, pensioners and passengers: New services launched; know how you benefit ",others
Grateful for looking into this and taking prompt action Kudos I have hope yet with  ,others
"Chhatisgarh also accounts for 1/6th of  annual revenue but has just over 1,500 kms of rail lines, le ",others
A smile suits every kind of clothes      ,others
Grateful for looking into this and taking prompt action Kudos I have hope yet with  ,others
guys...justify the cost u charge..   ,others
will be announcing the result for ALP CBT-2 tomorrow.    ,health
12 railway stations in NFR zone to get airport like facilities     xe2\x80\xa6,others
Safest year! This new record by  in FY19 will cheer every passenger   \,health
Safest year! This new record by  in FY19 will cheer every passenger   \,health
Safest year! This new record by  in FY19 will cheer every passenger   ,health
From 1am iam calling to  for enquiry of my train live status  15024  they stupids service  are not r ,journey
12 railway stations in NFR zone to get airport like facilities    ,others
"Microsoft to help  employees connect with  services using its  solution, which ",security
Check out the detailed information about Best Luxury Trains of India That Are the Pride of Indian Railways...know m ,others
"bIm sure the very able, and vocal ministers will come out to explain this. Slam the media and Nehru for the ills of ",health
Shouldnt Bhutans constitution to keep tourist attractions and environment clean be a part of every countrys constitut,clean
bShouldnt Bhutans constitution to keep tourist attractions and environment clean be a part of every countrys cons ,clean
"Please ensure proper water for passengers, more than 3 decades this Station and area i ",journey
"At a time when  needs to seriously bolster its  systems, this  exposes the poor functioni ",others
Train No.16532 GariNawaz. Does this run from Ksr Bangalore today??? Or the service has been diverted???,journey
Trains between Itarsi(et) And Mumbai(cstm) stations  ,journey
"India largest employer, , enables chat-based medical services. Indian Railway employees will be ab  Sir..I have made several times complaint and get resolved also..  Thanks to ",health
"Frequency is not yet improved, people working in IT needs proper frequency of train as OMR is stuck with traffic at ",others
Friyay \xf0\x9f\x98\x81\xf0\x9f\x98\x8d What do you plan to do this weekend? .              ,others
please dont upgrade Deccan Queen to Utkrisht rakes ... Its will spoil its heritage a ,health
bIndians are generally known to be good in  but that doesnt mean  decides to use a math proble ,others
bOn another side note.. Train is late by 2 hours. Dont think it would pick up speed either. Should have been close ,journey
Microsoft Kaizala enables Indian Railways to connect its three million employees with healthcare services. ,health
achieves 5 remarkable firsts in FY19! World-class trains and stations to high-powered locos. ,others
This  waiting lounge at  railway station is the epitome of luxury! Unmissable pics  182 RPF helpline number  no one is responding.   ,security
Doon express 13009 running already late by 6 hrs and train is standing in outskirt of Lucknow from 1 hr even when t ,journey
There is different time shown by Indian railways in LED WATHCH    ,others
But what about the railways ...? \xe2\x80\x8bThe myth of Britains gifts to India  The paragraph that I,others
bBut what about the railways ...? \xe2\x80\x8bThe myth of Britains gifts to India  The paragraph that ,others
Lucknow Swarn Shatabdi- Food Served  via .    ,food
"here is a fantasy work dedicated to art students of Khairagarh university , Chhatishgarh, painted during the ongoing Inte",others
"New Line, Doubling, Tripling and Gauge Conversion: Targets for FY 2019-20    hello sir, can you help me to reach my dad. we are worried and unable to contact him.  ",security
"Never in the history, Indian railways has got this much of push from the Govt.  great things happening in the",journey
"Never in the history, Indian railways has got this much of push from the Govt.  great things happeni ",journey
This  waiting lounge at  railway station is the epitome of luxury! Unmissable pics ,others
This  waiting lounge at  railway station is the epitome of luxury! Unmissable pics ,others
"While the  &  have defaulted on property tax payment to the , state roadways tra ",others
This  waiting lounge at  railway station is the epitome of luxury! Unmissable pics  every traveller has leftovers. What a waste of food in this country? Have some shame..  ,food
PNR 8504500514 confirmed one seat for Son but Mother seat not confirmed now I cant c ,others
Indian Railways plans to develop \xe2\x80\x98eco-smart stations\xe2\x80\x99      ,others
PNR 8504500514 confirmed one seat for Son but Mother seat not confirmed now I cant cancel nor I ca ,others
sir my family traveling with my family in train no.18030 with pnr no:  coach no:       Chat based medical services is a un ,others
The  said it will use  Kaizala to connect its employees across the country with quality ,health
Condition of DOOR in JpUdz SF Express Train No. 12992    ,others
13 Amazing Facts About  That You May Not Know  via \One of the biggest & most intense ,others
achieves 5 remarkable firsts in FY19! World-class trains and stations to high-powered locos - The F ,others
"The Indian Railway Board provided Segways, a two-wheeled, self-balancing, battery-powered electric vehicle to the R ",others
Kudos to PM led govt for transforming the face of our  & \,others
"New Line, Doubling, Tripling and Gauge Conversion: Targets for FY 2019-20",others
no coach cleaning available in Train no. 18609 i.e. Toilet water running in the compartm ,journey
Diesel lobby reigns supreme and thus 100s of diesel fume spouting End On Generators enter and exit NCR everyday. ,others
Trains between Cuttack(ctc) And Gondia(g) stations  ,journey
Highbar Technocrat Ltd. participated in 8th Annual Metro Rail India Summit 2019.   ,others
"bBig  gift: Use  stations luxury lounge, renovated retiring rooms; know charges, facilities       ",others
"A rail push trolley\xc2\xa0\xc2\xa0is a hand-pushed trolley, it was  used to inspect the rails\xc2\xa0.    ",security
"Okay. If there no staff present, these seats will run vacant and 16 deserving nationals who\xe2\x80\x99ve paid for the ticke ",health
bGenerator Van of GariRath is apparently making the environment GARI very badly!   ,digital
Train no. 12224 Duronto Express coach B6. Air condition is not working. Approached the engineers but are not respon ,digital
Vlog On Journey From Delhi To Mumbai By  Train Is oUt Guys..  .  ,journey
ko sudhar to payi nhi    me fir se  chahiye. ,others
"Did you know,  takes 25 crore passengers daily to their desired destinations?  ",others
Travelling by train no. 12701 to Hyderabad. There is no water in the coach no. S2. Hopefully it will be resolved so ,journey
"Targets for 2019-20 set at 10,319 km on   ",others
"The haunting beauty of a solitary rail line in a desolate Ghat section, moving into a tunnel! Picture credit - ",others
I am in 14055 Brahmputra Express. PNR No. 6527303522. I would like to request you to clean the washroom. It is in v ,clean
PNR 8717284054 pehle bole hotte toh pillow sath le atee..  yeh use karne se ,health
